{
  "specversion": "1.0",
  "type": "com.mbta.ctd.subwayside.train-heartbeat",
  "id": "200081266220230427135628421",
  "source": "hsctdprd.mbta.com/subwayside-12345",
  "time": "2023-05-22T13:32:45Z",
  "partitionkey": "O2000812662",
  "data": {
    "receivedDt": "2023-04-27T13:56:28.420999Z",
    "createdDt": "2023-05-22T13:32:45Z",
    "transmissionDt": "2023-05-22T13:33:00Z",
    "flags": {
      "carNbrValid": true,
      "transmissionDtValid": true,
      "shopMode": false,
      "timeSyncGps": true,
      "speedValid": true,
      "gpsValid": true,
      "operationDataValid": true,
      "ptuConnected": true,
      "cellularUp": false,
      "wifiUp": [false, false],
      "modemGwuc": true,
      "critical": true,
      "dead": false
    },
    "commId": 51462,
    "commCarNbr": "1445",
    "activeCarNbr": "1445",
    "primaryCarNbr": "1445",
    "sourceCarNbr": "1445",
    "leadCarNbr": "1445",
    "operationLine": "Orange",
    "trainDirection": "LEFT",
    "numberOfCars": 6,
    "leaderMcuCarNbr": "1445",
    "masterMcuCarNbrs": ["1234", "2345"],
    "cars": [
      {
        "nbr": "1445",
        "type": "CAB",
        "flags": {
          "online": true,
          "master": true,
          "faultLog": false,
          "mileageValid": true,
          "maintenancePasswordVersionValid": true
        },
        "maintenancePasswordVersion": "00.00",
        "mileageMi": 78920.9846,
        "systems": {
          "gcu1": { "online": false },
          "gcu2": { "online": false },
          "api": { "online": false },
          "atpN": { "online": false },
          "atpR": { "online": false },
          "nvr": { "online": false },
          "vms": { "online": false },
          "mcu": { "online": false },
          "dcuA1": { "online": false },
          "dcuA2": { "online": false },
          "dcuB1": { "online": false },
          "dcuB2": { "online": false },
          "dcuC1": { "online": false },
          "dcuC2": { "online": false },
          "dcuD1": { "online": false },
          "dcuD2": { "online": false },
          "dcuE1": { "online": false },
          "dcuE2": { "online": false },
          "dcuF1": { "online": false },
          "dcuF2": { "online": false },
          "dcuG1": { "online": false },
          "dcuG2": { "online": false },
          "dcuH1": { "online": false },
          "dcuH2": { "online": false },
          "ers": { "online": false },
          "mbcu1": {
            "valid": true,
            "online": false,
            "faultSeverity": 0,
            "fault": false
          },
          "mbcu2": { "online": false },
          "hvac1": { "online": false },
          "hvac2": { "online": false },
          "pcu1": { "online": false },
          "pcu2": { "online": false },
          "lvps": { "online": false },
          "gwuc": { "online": false }
        },
        "faultSeverity": null,
        "airSpringPressure": [564, 564],
        "loadWeightLb": [79280, 79280],
        "gwucWanState": "INITIALIZING",
        "wifiState": ["CONNECTING", "DISABLED"]
      }
    ],
    "speedMph": 5,
    "latitude": 42.437278,
    "longitude": -71.07084,
    "destinationStation": null,
    "currentStation": {
      "id": 376,
      "name": "Malden Center"
    },
    "nextStation": null,
    "runningDistanceMi": 11.147,
    "routeCode": "1002"
  }
}
